{
  "schemaVersion": "cm.public-video-process-delta/v1",
  "deltaId": "public-video-process-delta-2026-08-03-01",
  "methodologyVersion": "2026.08.02-v2",
  "status": "ACCEPTED",
  "sourceEvidenceSha256": "b6e24f9ab9629c56cf4748c0d5de7e9ce5440bc73c73bbf253aecd6436f4d432",
  "portableImprovements": [
    {
      "id": "publication-ready-audience-copy-gate",
      "classification": "portable-now",
      "rule": "Reject production and review workflow status from voice-over, subtitles, on-screen text, thumbnails, public metadata, and final ASR/OCR while preserving legitimate product-maturity boundaries and verified public Release Truth.",
      "publicComponents": ["public-copy policy", "job preflight", "evidence manifest", "positive and negative fixtures", "Docker smoke"]
    },
    {
      "id": "audience-copy-fixture-freshness",
      "classification": "portable-now",
      "rule": "Fail closed when the policy checksum, required channel coverage, or per-rule negative fixture coverage is stale or incomplete.",
      "publicComponents": ["fixture validator", "unit tests", "in-container smoke"]
    }
  ],
  "evidenceBoundary": {
    "historicalEvidenceRewritten": false,
    "privateRunArtifactsPublished": false,
    "productionClaim": false,
    "note": "The source digest binds the public positive and negative fixture matrix; operational status remains valid only in non-audience sidecar evidence and delivery messages."
  }
}
